{
  "$schema": "../meta-schema.json",
  "data": [{ "offset": 0, "hex": "48656c6c6f2c20576f726c64210a00" }],
  "types": [
    { "type": "(u8[])->()" },
    { "type": "()->()" },
    { "type": "comptime_string(14)" },
    { "type": "(i32, i32)", "symbol": 2 },
    { "type": "i32", "symbol": 3 },
    { "type": "u8[14/0]" },
    { "type": "comptime_int(10)" },
    { "type": "comptime_int(20)" },
    { "type": "comptime_int(42)" }
  ],
  "symbols": [
    { "name": "log", "kind": "func", "type": 0, "def": "3:19", "refs": ["13:2"], "doc": "Import JavaScript console.log" },
    { "name": "main", "kind": "func", "type": 1, "def": "9:0", "refs": [] },
    { "name": "Point", "kind": "type", "type": 3, "def": "5:5", "refs": ["14:9"] },
    { "name": "Index", "kind": "unique", "type": 4, "def": "6:7", "refs": ["15:11"] },
    { "name": "message", "kind": "local", "type": 5, "def": "10:6", "refs": ["13:6"] },
    { "name": "p", "kind": "local", "type": 3, "def": "14:6", "refs": [] },
    { "name": "idx", "kind": "local", "type": 4, "def": "15:6", "refs": [] }
  ],
  "src": "file://./hello.ents",
  "hints": {
    "3:19": { "len": 3, "type": 0, "symbol": 0 },
    "5:5": { "len": 5, "type": 3, "symbol": 2 },
    "6:7": { "len": 5, "type": 4, "symbol": 3 },
    "9:0": { "len": 4, "type": 1, "symbol": 1 },
    "10:6": { "len": 7, "type": 5, "symbol": 4 },
    "10:16": { "len": 17, "type": 2, "data": 0 },
    "13:2": { "len": 3, "type": 0, "symbol": 0 },
    "13:6": { "len": 7, "type": 5, "symbol": 4 },
    "14:6": { "len": 1, "type": 3, "symbol": 5 },
    "14:9": { "len": 5, "type": 3, "symbol": 2 },
    "14:18": { "len": 2, "type": 6 },
    "14:22": { "len": 2, "type": 7 },
    "15:6": { "len": 3, "type": 4, "symbol": 6 },
    "15:11": { "len": 5, "type": 4, "symbol": 3 },
    "15:19": { "len": 2, "type": 8 }
  }
}
